<?xml version="1.0" encoding="UTF-8"?>
<circuito xmlns="http://www.uniovi.es"
    xmlns:xsi="http://www.w3.org/2001/XMLSchema-instance"
    xsi:schemaLocation="http://www.uniovi.es circuito.xsd">
    <nombre>A. Hermanos Rodríguez</nombre>
    <longitud_circuito unidades="kilometros">4.421</longitud_circuito>
    <anchura unidades="metros">15</anchura>
    <fecha_carrera>2024-10-27</fecha_carrera>
    <hora>21:00</hora>
    <vueltas>71</vueltas>
    <localidad>Ciudad de México</localidad>
    <pais>México</pais>
    <referencias>
        <referencia>
            https://www.dazn.com/es-ES/news/motor/autodromo-hermanos-rodriguez-donde-como-caracteristicas-llegar-fotos-escenario-gp-mexico-mundial-f1/mxpvg88ch1as1qky18rqbe3ex</referencia>
        <referencia>https://www.formula1.com/en/racing/2024/mexico</referencia>
        <referencia>
            https://www.caranddriver.com/es/formula-1/calendario/g44472722/formula-1-calendario-2024/</referencia>
    </referencias>
    <galeria_fotografias>
        <fotografia>circuito.jpg</fotografia>
        <fotografia>circuito2.jpg</fotografia>
    </galeria_fotografias>
    <coordenadas>

        <longitud>19.2422</longitud>
        <latitud>-99.0540</latitud>
        <altitud>2231.27</altitud>
    </coordenadas>

    <tramos>
        <tramo>
            <coordenadas>
                <longitud>19.2417</longitud>
                <latitud>-99.0502</latitud>
                <altitud>2231.01</altitud>
            </coordenadas>
        </tramo>

        <tramo>
            <coordenadas>
                <longitud>19.2417</longitud>
                <latitud>-99.0501</latitud>
                <altitud>2230.96</altitud>
            </coordenadas>
        </tramo>

        <tramo>
            <coordenadas>
                <longitud>19.2416</longitud>
                <latitud>-99.0501</latitud>
                <altitud>2230.94</altitud>
            </coordenadas>
        </tramo>

        <tramo>
            <coordenadas>
                <longitud>19.2415</longitud>
                <latitud>-99.0501</latitud>
                <altitud>2231.02</altitud>
            </coordenadas>
        </tramo>

        <tramo>
            <coordenadas>
                <longitud>19.2414</longitud>
                <latitud>-99.0501</latitud>
                <altitud>2230.98</altitud>
            </coordenadas>
        </tramo>

        <tramo>
            <coordenadas>
                <longitud>19.2413</longitud>
                <latitud>-99.0501</latitud>
                <altitud>2231.05</altitud>
            </coordenadas>
        </tramo>

        <tramo>
            <coordenadas>
                <longitud>19.2413</longitud>
                <latitud>-99.0500</latitud>
                <altitud>2231.01</altitud>
            </coordenadas>
        </tramo>

        <tramo>
            <coordenadas>
                <longitud>19.2412</longitud>
                <latitud>-99.0459</latitud>
                <altitud>2231</altitud>
            </coordenadas>
        </tramo>

        <tramo>
            <coordenadas>
                <longitud>19.2410</longitud>
                <latitud>-99.0459</latitud>
                <altitud>2231.2</altitud>
            </coordenadas>
        </tramo>
        <tramo>
            <coordenadas>
                <longitud>19.2407</longitud>
                <latitud>-99.0500</latitud>
                <altitud>2226.2</altitud>
            </coordenadas>
        </tramo>
        <tramo>
            <coordenadas>
                <longitud>19.2353</longitud>
                <latitud>-99.0510</latitud>
                <altitud>2228</altitud>
            </coordenadas>
        </tramo>
        <tramo>
            <coordenadas>
                <longitud>19.2352</longitud>
                <latitud>-99.0508</latitud>
                <altitud>2229</altitud>
            </coordenadas>
        </tramo>
        <tramo>
            <coordenadas>
                <longitud>19.2407</longitud>
                <latitud>-99.0500</latitud>
                <altitud>2229</altitud>
            </coordenadas>
        </tramo>
        <tramo>
            <coordenadas>
                <longitud>19.2349</longitud>
                <latitud>-99.0512</latitud>
                <altitud>2229</altitud>
            </coordenadas>
        </tramo>
        <tramo>
            <coordenadas>
                <longitud>19.2400</longitud>
                <latitud>-99.0511</latitud>
                <altitud>2227</altitud>
            </coordenadas>
        </tramo>
        <tramo>
            <coordenadas>
                <longitud>19.2402</longitud>
                <latitud>-99.0514</latitud>
                <altitud>2228</altitud>
            </coordenadas>
        </tramo>
        <tramo>
            <coordenadas>
                <longitud>19.2404</longitud>
                <latitud>-99.0515</latitud>
                <altitud>2228</altitud>
            </coordenadas>
        </tramo>
        <tramo>
            <coordenadas>
                <longitud>19.2405</longitud>
                <latitud>-99.0516</latitud>
                <altitud>2227</altitud>
            </coordenadas>
        </tramo>
        <tramo>
            <coordenadas>
                <longitud>19.2406</longitud>
                <latitud>-99.0521</latitud>
                <altitud>2227</altitud>
            </coordenadas>
        </tramo>
        <tramo>
            <coordenadas>
                <longitud>19.2406</longitud>
                <latitud>-99.0522</latitud>
                <altitud>2227</altitud>
            </coordenadas>
        </tramo>
        <tramo>
            <coordenadas>
                <longitud>19.2408</longitud>
                <latitud>-99.0523</latitud>
                <altitud>2229</altitud>
            </coordenadas>
        </tramo>
        <tramo>
            <coordenadas>
                <longitud>19.2409</longitud>
                <latitud>-99.0524</latitud>
                <altitud>2227</altitud>
            </coordenadas>
        </tramo>
        <tramo>
            <coordenadas>
                <longitud>19.2411</longitud>
                <latitud>-99.0528</latitud>
                <altitud>2228</altitud>
            </coordenadas>
        </tramo>
        <tramo>
            <coordenadas>
                <longitud>19.2413</longitud>
                <latitud>-99.0541</latitud>
                <altitud>2227</altitud>
            </coordenadas>
        </tramo>
        <tramo>
            <coordenadas>
                <longitud>19.2413</longitud>
                <latitud>-99.0542</latitud>
                <altitud>2227</altitud>
            </coordenadas>
        </tramo>
        <tramo>
            <coordenadas>
                <longitud>19.2419</longitud>
                <latitud>-99.0542</latitud>
                <altitud>2227</altitud>
            </coordenadas>
        </tramo>
        <tramo>
            <coordenadas>
                <longitud>19.2419</longitud>
                <latitud>-99.0543</latitud>
                <altitud>2226</altitud>
            </coordenadas>
        </tramo>
        <tramo>
            <coordenadas>
                <longitud>19.2418</longitud>
                <latitud>-99.0544</latitud>
                <altitud>2227</altitud>
            </coordenadas>
        </tramo>
        <tramo>
            <coordenadas>
                <longitud>19.2418</longitud>
                <latitud>-99.0545</latitud>
                <altitud>2227</altitud>
            </coordenadas>
        </tramo>
        <tramo>
            <coordenadas>
                <longitud>19.2413</longitud>
                <latitud>-99.0541</latitud>
                <altitud>2227</altitud>
            </coordenadas>
        </tramo>
        <tramo>
            <coordenadas>
                <longitud>19.2419</longitud>
                <latitud>-99.0548</latitud>
                <altitud>2229</altitud>
            </coordenadas>
        </tramo>
        <tramo>
            <coordenadas>
                <longitud>19.2421</longitud>
                <latitud>-99.0547</latitud>
                <altitud>2227</altitud>
            </coordenadas>
        </tramo>
        <tramo>
            <coordenadas>
                <longitud>19.2423</longitud>
                <latitud>-99.0545</latitud>
                <altitud>2227</altitud>
            </coordenadas>
        </tramo>
        <tramo>
            <coordenadas>
                <longitud>19.2423</longitud>
                <latitud>-99.0544</latitud>
                <altitud>2227</altitud>
            </coordenadas>
        </tramo>
        <tramo>
            <coordenadas>
                <longitud>19.2417</longitud>
                <latitud>-99.0502</latitud>
                <altitud>2231.01</altitud>
            </coordenadas>
        </tramo>
    </tramos>
</circuito>